47,Ag,Silver,107.8682,Silver is somewhat rare and expensive although not as expensive as gold. Slag dumps in Asia Minor and on islands in the Aegean Sea indicate that man learned to separate silver from lead as early as 3000 B.C. Pure silver has a brilliant white metallic lustre. It is a little harder than gold and is very ductile and malleable. Pure silver has the highest electrical and thermal conductivity of all metals and possesses the lowest contact resistance. Silver iodide AgI is (or was?) used for causing clouds to produce rain. Info courtesy http://www.webelements.com/ ,TRUE,47.jpg48,Cd,Cadmium,112.411,"Cadmium is a soft bluish-white metal and is easily cut with a knife. It is similar in many respects to zinc. Interestingly aa characteristic cadmium ""scream"" is heard on bending a cadmium bar (such as that illustrated above). Cadmium and its compounds are highly toxic. Silver solder which contains cadmium should be handled with care. Info courtesy http://www.webelements.com/ ",TRUE,48.jpg49,In,Indium,114.818,"Indium is a very soft silvery-white metal with a brilliant lustre. The pure metal gives a high-pitched ""scream"" when bent. It wets glass as does gallium. It is useful for making low-melting alloys. An alloy of 24% indium and 76% gallium is liquid at room temperature. Canada produces the majority of of the world's supply of indium. Info courtesy http://www.webelements.com/ ",TRUE,49.jpg50,Sn,Tin,118.71,"Ordinary tin is a silvery-white metal is malleable somewhat ductile and has a highly crystalline structure. Due to the breaking of these crystals a ""tin cry"" is heard when a bar is bent. The element has two allotropic forms. On warming grey or _-tin with a cubic structure changes at 13.2¡C into white or _-tin the ordinary form of the metal. White tin has a tetragonal structure. When tin is cooled below 13.2¡C it changes slowly from white to grey. This change is affected by impurities such as aluminium and zinc and can be prevented by small additions of antimony or bismuth. The conversion was first noted as growths on organ pipes in European cathedrals where it was thought to be the devils work. This conversion was also speculated to be caused microorganisms and was called ""tin plague"" or ""tin disease"". Info courtesy http://www.webelements.com/ ",TRUE,50.jpg51,Sb,Antimony,121.76,Metallic antimony is an extremely brittle metal of a flaky crystalline texture. It is bluish white and has a metallic lustre. It is not acted on by air at room temperature but burns brilliantly when heated with the formation of white fumes. It is a poor conductor of heat and electricity. Antimony and its compounds are toxic. It is found mostly with other minerals and in stibnite. Info courtesy http://www.webelements.com/ ,FALSE,51.jpg52,Te,Tellurium,127.6,"Crystalline tellurium has a silvery-white appearance and exhibits a metallic lustre when pure (see above). It is brittle and easily pulverised. Tellurium is a p-type semiconductor and shows varying conductivity with crystal alignment. Its conductivity increases slightly with exposure to light. It can be doped with silver copper gold tin or other elements. Humans exposed to as little as 0.01 mg m-3 in air or less develop ""tellurium breath"" which has a garlic-like odour. Info courtesy http://www.webelements.com/ ",FALSE,52.jpg53,I,Iodine,126.90447,Iodine is a bluish-black lustrous solid. It volatilises at ambient temperatures into a pretty blue-violet gas with an irritating odour. It forms compounds with most elements but is less reactive than the other halogens which displace it from iodides. Iodine exhibits some metallic-like properties. It dissolves readily in chloroform carbon tetrachloride or carbon disulphide to form beautiful purple solutions. It is only slightly soluble in water. Iodine compounds are important in organic chemistry and very useful in medicine and photography. Lack of iodine is the cause of goitre (Derbyshire neck). The deep blue colour with starch solution is characteristic of the free element. It is assimilated by seaweeds from which it may be recovered and is found in Chilean saltpetre caliche old salt brines and salt wells. Info courtesy http://www.webelements.com/ ,FALSE,53.jpg54,Xe,Xenon,131.293,"Xenon is a ""noble"" or ""inert"" gas present in the atmosphere to a small extent. Xenon is present in the Martian atmosphere to the extent of about 0.08 ppm. Before 1962 it was generally assumed that xenon and other noble gases were unable to form compounds. Among the compounds of xenon now reported are xenon hydrate sodium perxenate xenon deuterate difluoride tetrafluoride hexafluoride and XePtF6 and XeRhF6. The highly explosive xenon trioxide XeO3 is known. Info courtesy http://www.webelements.com/ ",FALSE,54.jpg55,Cs,Cesium,132.9054519,Caesium is known as cesium in the USA. The metal is characterised by a spectrum containing two bright lines in the blue (accounting for its name). It is silvery gold soft and ductile. It is the most electropositive and most alkaline element. Caesium gallium and mercury are the only three metals that are liquid at or around room temperature. Caesium reacts explosively with cold water and reacts with ice at temperatures above -116¡C. Caesium hydroxide is a strong base and attacks glass. Info courtesy http://www.webelements.com/ ,TRUE,55.jpg56,Ba,Barium,137.327,Barium is a metallic element soft and when pure is silvery white like lead. The metal oxidises very easily and it reacts with water or alcohol. Barium is one of the alkaline-earth metals. Small amounts of barium compounds are used in paints and glasses. Info courtesy http://www.webelements.com/ ,TRUE,56.jpg57,La,Lanthanum,138.90547,Lanthanum is silvery white malleable ductile and soft enough to be cut with a knife. It is one of the most reactive of the rare-earth metals. It oxidises rapidly when exposed to air. Cold water attacks lanthanum slowly and hot water attacks it much more rapidly. The metal reacts directly with elemental carbon nitrogen boron selenium silicon phosphorus sulphur and with halogens. It is a component of misch metal (used for making lighter flints). Info courtesy http://www.webelements.com/ ,TRUE,57.jpg58,Ce,Cerium,140.116,Metallic cerium is prepared by reduction techniques such as by reducing cerous fluoride with calcium or by electrolysis of molten cerous chloride or other cerous halides. Cerium is an iron-grey lustrous metal. It is malleable and oxidises very readily at room temperature especially in moist air. Except for europium cerium is the most reactive of the rare-earth metals. It slowly decomposes in cold water and rapidly in hot water. Alkali solutions and dilute and concentrated acids attack the metal rapidly. The pure metal may ignite when scratched with a knife. Info courtesy http://www.webelements.com/ ,TRUE,58.jpg59,Pr,Praseodymium,140.90765,"Praseodymium is soft silvery malleable and ductile. It was prepared in relatively pure form in 1931. It is somewhat more resistant to corrosion in air than europium lanthanum cerium or neodymium but it does develop a green oxide coating that ""spalls"" away when exposed to air. The metal should be stored under an inert atmosphere or under mineral oil or petroleum. Info courtesy http://www.webelements.com/ ",TRUE,59.jpg60,Nd,Neodymium,144.242,Neodymium is present in misch metal to the extent of about 18%. The metal has a bright silvery metallic lustre. Neodymium is one of the more reactive rare-earth metals and quickly tarnishes in air forming an oxide that spalls off and exposes the metal to further oxidation. It is one of the rare earth metals. Info courtesy http://www.webelements.com/ ,TRUE,60.jpg61,Pm,Promethium,145,Great care is required while handling promethium as a consequence of its radioactivity. Promethium salts luminesce in the dark with a pale blue or greenish glow due to their high radioactivity. Ion-exchange methods led to the preparation of about 10 g of promethium from atomic reactor fuel processing wastes in early 1963. Little is yet generally known about the properties of metallic promethium. More than 30 promethium compounds have been prepared. Promethium is a rare earth metal. It appears that there is no known Pm existing in the earth's crust. Info courtesy http://www.webelements.com/ ,TRUE,61.jpg62,Sm,Samarium,150.36,Samarium has a bright silver lustre and is reasonably stable in air. It ignites in air at 150¡C. It is a rare earth metal. It is found with other rare earth elements in minerals including monazite and bastnaesite and is used in electronics industries. Info courtesy http://www.webelements.com/ ,TRUE,62.jpg63,Eu,Europium,151.964,Europium ignites in air at about 150 to 180¡C. Europium is about as hard as lead and is quite ductile. It is the most reactive of the rare earth metals quickly oxidising in air. It resembles calcium in its reaction with water. It is used in television screens to produce a red colour. Info courtesy http://www.webelements.com/ ,TRUE,63.jpg64,Gd,Gadolinium,157.25,"Gadolinium is silvery white has a metallic lustre and is is malleable and ductile. It is ferromagnetic (strongly attracted by a magnet). The metal is relatively stable in dry air but in moist air it tarnishes with the formation of a loosely adhering oxide film which ""spalls"" off and exposes more surface to oxidation. The metal reacts slowly with water and is soluble in dilute acid. Gadolinium has the highest thermal neutron capture cross-section of any known element. Info courtesy http://www.webelements.com/ ",TRUE,64.jpg65,Tb,Terbium,158.92535,Terbium is reasonably stable in air. It is a silvery-grey metal and is malleable ductile and soft enough to be cut with a knife. It is a rare earth metal found in cerite gadolinite and monazite. The element itself was isolated only recently. Info courtesy http://www.webelements.com/ ,TRUE,65.jpg66,Dy,Dysprosium,162.5001,Dysprosium has a metallic bright silver lustre. It is relatively stable in air at room temperature but dissolves readily with the evolution of hydrogen in mineral acids. The metal is soft enough to be cut with a knife and can be machined without sparking if overheating is avoided. It is a rare earth metal found in minerals such as xenotime monazite and bastnaesite. Info courtesy http://www.webelements.com/ ,TRUE,66.jpg67,Ho,Holmium,164.93032,Holmium is relatively soft and malleable and is stable in dry air at room temperature. It oxidises rapidly in moist air and at elevated temperatures. The metal has unusual magnetic properties. The metal is a rare earth metal found in monazite gadolinite and other minerals. Info courtesy http://www.webelements.com/ ,TRUE,67.jpg68,Er,Erbium,167.259,Pure erbium metal is soft and malleable and has a bright silvery metallic lustre. As with other rare-earth metals its properties depend to a certain extent on impurities present. The metal is fairly stable in air and does not oxidise as rapidly as some of the other rare-earth metals. Info courtesy http://www.webelements.com/ ,TRUE,68.jpg69,Tm,Thulium,168.93421,Thulium is the least abundant of the earth elements and is about as rare as silver gold or cadmium. The pure metal has a bright silvery lustre. It is reasonably stable in air but the metal must be protected from moisture. The element is silvery-grey soft malleable and ductile and can be cut with a knife. It is a rare earth metal found in minerals such as monazite. Info courtesy http://www.webelements.com/ ,TRUE,69.jpg70,Yb,Ytterbium,173.054,Ytterbium has a bright silvery lustre is soft malleable and quite ductile. While the element is fairly stable it should be kept in closed containers to protect it from air and moisture. Ytterbium is readily attacked and dissolved by mineral acids and reacts slowly with water. Info courtesy http://www.webelements.com/ ,TRUE,70.jpg71,Lu,Lutetium,174.9668,Pure metallic lutetium has been isolated only in recent years and is one of the more difficult to prepare. It can be prepared by the reduction of anhydrous LuCl3 or LuF3 by an alkali or alkaline earth metal. The metal is silvery white and relatively stable in air. It is a rare earth metal and perhaps the most expensive of all rare elements. It is found in small amounts with all rare earth metals and is very difficult to separate from other rare elements. Info courtesy http://www.webelements.com/ ,TRUE,71.jpg72,Hf,Hafnium,178.49,Most zirconium minerals contain 1 to 3% hafnium. Hafnium is a ductile metal with a brilliant silver lustre. Its properties are influenced considerably by the impurities of zirconium present. Of all the elements zirconium and hafnium are two of the most difficult to separate. Hafnium is a Group 4 transition element. Because hafnium has a good absorption cross section for thermal neutrons (almost 600 times that of zirconium) has excellent mechanical properties and is extremely corrosion resistant it is used for nuclear reactor control rods. Info courtesy http://www.webelements.com/ ,TRUE,72.jpg73,Ta,Tantalum,180.94788,Tantalum is a greyish silver heavy and very hard metal. When pure it is ductile and can be drawn into fine wire which can be used as a filament for evaporating metals such as aluminium. Tantalum is almost completely immune to chemical attack at temperatures below 150¡C and is attacked only by hydrofluoric acid acidic solutions containing the fluoride ion and free sulphur trioxide. The element has a melting point exceeded only by tungsten and rhenium. Info courtesy http://www.webelements.com/ ,TRUE,73.jpg74,W,Tungsten,183.84,Pure tungsten is a steel-gray to tin-white metal. Tungsten has the highest melting point and lowest vapour pressure of all metals and at temperatures over 1650¡C has the highest tensile strength. The metal oxidises in air and must be protected at elevated temperatures. It has excellent corrosion resistance and is attacked only slightly by most mineral acids. Info courtesy http://www.webelements.com/ ,TRUE,74.jpg75,Re,Rhenium,186.207,Rhenium is silvery white with a metallic lustre; its density is exceeded only by that of platinum iridium and osmium and its melting point is exceeded only by that of tungsten and carbon. It has other useful properties. It is expensive but useful as a trace alloying agent. Info courtesy http://www.webelements.com/ ,TRUE,75.jpg76,Os,Osmium,190.23,Ruthenium rhodium palladium osmium iridium and platinum together make up a group of elements referred to as the platinum group metals (PGM). Osmium metal is lustrous bluish white extremely hard and brittle even at high temperatures. It has the highest melting point and lowest vapour pressure of the platinum group. The metal is very difficult to fabricate but the powder can be sintered in a hydrogen atmosphere at a temperature of 2000¡C. The solid metal is not affected by air at room temperature but the powdered or spongy metal slowly gives off osmium tetroxide which is a powerful oxidising agent and has a strong smell. The tetroxide is highly toxic and boils at 130¡C (760 mm). Concentrations in air as low as 10-7 g m-3 can cause lung congestion skin damage or eye damage. Info courtesy http://www.webelements.com/ ,TRUE,76.jpg77,Ir,Iridium,192.217,Ruthenium rhodium palladium osmium iridium and platinum together make up a group of elements referred to as the platinum group metals (PGM). The name iridium is appropriate for its salts are highly coloured. Iridium is white similar to platinum but with a slight yellowish cast. It is very hard and brittle making it very hard to machine form or work. It is the most corrosion resistant metal known and was used in making the standard metre bar of Paris which is a 90% platinum-10% iridium alloy. This metre bar has since been replaced as a fundamental unit of length (see Krypton). Info courtesy http://www.webelements.com/ ,TRUE,77.jpg78,Pt,Platinum,192.084,Ruthenium rhodium palladium osmium iridium and platinum together make up a group of elements referred to as the platinum group metals (PGM). Platinum is a beautiful silvery-white metal when pure and is malleable and ductile. It has a coefficient of expansion almost equal to that of soda-lime-silica glass and is therefore used to make sealed electrodes in glass systems. Info courtesy http://www.webelements.com/ ,TRUE,78.jpg79,Au,Gold,196.966569,"Most metals are metallic grey or silvery white whereas gold is characteristically a metallic yellow colour in other words gold-coloured. Caesium is also gold coloured. The gold colour seems related to relativistic effects of the outermost gold orbitals. Small amounts of other metals alloyed with gold change the colour as well as mechanical properties such as hardness. White gold for jewellery is formed by mixing palladium silver or nickel with gold although the result is green gold with certain proportions of silver. White gold is commonly used for wedding rings in the USA. Addition of some copper gives ""rose gold"" a soft pink colour. Remarkably other colours such as purple (a gold:aluminium alloy) blue (a gold:indium alloy) and even black (a gold:cobalt alloy) may be formed. Info courtesy http://www.webelements.com/ ",TRUE,79.jpg80,Hg,Mercury,200.59,Mercury is the only common metal liquid at ordinary temperatures. Mercury is sometimes called quicksilver. It rarely occurs free in nature and is found mainly in cinnabar ore (HgS) in Spain and Italy. It is a heavy silvery-white liquid metal. It is a rather poor conductor of heat as compared with other metals but is a fair conductor of electricity. It alloys easily with many metals such as gold silver and tin. These alloys are called amalgams. Its ease in amalgamating with gold is made use of in the recovery of gold from its ores. Info courtesy http://www.webelements.com/ ,TRUE,80.jpg81,Tl,Thallium,204.3833,When freshly exposed to air thallium exhibits a metallic lustre but soon develops a bluish-grey tinge resembling lead in appearance. A heavy oxide builds up on thallium if left in air and in the presence of water the hydroxide is formed. The metal is very soft and malleable. It can be cut with a knife. The element and its compounds are toxic and should be handled carefully. Thallium may cause cancer. Info courtesy http://www.webelements.com/ ,TRUE,81.jpg82,Pb,Lead,207.2,Lead is a bluish-white lustrous metal. It is very soft highly malleable ductile and a relatively poor conductor of electricity. It is very resistant to corrosion but tarnishes upon exposure to air. Lead pipes bearing the insignia of Roman emperors used as drains from the baths are still in service. Alloys include pewter and solder. Tetraethyl lead (PbEt4) is still used in some grades of petrol (gasoline) but is being phased out on environmental grounds. Info courtesy http://www.webelements.com/ ,TRUE,82.jpg83,Bi,Bismuth,208.980401,Bismuth is a white crystalline brittle metal with a pinkish tinge. Bismuth is the most diamagnetic of all metals and the thermal conductivity is lower than any metal except mercury. It has a high electrical resistance and has the highest Hall effect of any metal (that is the greatest increase in electrical resistance when placed in a magnetic field). Info courtesy http://www.webelements.com/ ,TRUE,83.jpg84,Po,Polonium,210,Polonium has more isotopes than any other element all of which are radioactive. Polonium dissolves readily in dilute acids but is only slightly soluble in alkalis. Weight for weight it is about 2.5 x 1011 times as toxic as hydrocyanic acid (HCN). Polonium has been found in tobacco as a contaminant and in uranium ores. Info courtesy http://www.webelements.com/ ,FALSE,84.jpg85,At,Astatine,210,The longest-lived isotope 210At has a half-life of only 8.3 hours. There are about 20 isotopes known all of which are radioactive. Astatine is a halogen and possibly accumulates in the thyroid like iodine. Info courtesy http://www.webelements.com/ ,FALSE,85.jpg86,Rn,Radon,220,At ordinary temperatures radon is a colourless gas. When cooled below the freezing point radon exhibits a brilliant phosphorescence which becomes yellow as the temperature is lowered and orange-red at the temperature of liquid air. The main hazard is from inhalation of the element and its decay products which are collected on dust in the air. Recently radon buildup in homes from the surrounding soil and rocks has become a safety issue and some areas around the world test homes for radon gas. It is the heaviest known gas. Radon is present in some spring waters. Info courtesy http://www.webelements.com/ ,FALSE,86.jpg87,Fr,Francium,223,Francium occurs as a result of _ disintegration of actinium. Francium is found in uranium minerals and can be made artificially by bombarding thorium with protons. It is the most unstable of the first 101 elements. The longest lived isotope 223Fr a daughter of 227Ac has a half-life of 22 minutes. This is the only isotope of francium occurring in nature but at most there is only 20-30 g of the element present in the earth's crust at any one time. No weighable quantity of the element has been prepared or isolated. There are about 20 known isotopes. Info courtesy http://www.webelements.com/ ,TRUE,87.jpg88,Ra,Radium,226,Pure metallic radium is brilliant white when freshly prepared but blackens on exposure to air probably due to formation of the nitride. It exhibits luminescence as do its salts; it decomposes in water and is somewhat more volatile than barium. Radium imparts a carmine red colour to a flame. Info courtesy http://www.webelements.com/ ,TRUE,88.jpg89,Ac,Actinium,227,Actinium is dangerously radioactive. The chemical behaviour of actinium is similar to that of the rare earths particularly lanthanum. It is found naturally in uranium ores and actinium is 150 times more radioactive than radium. Info courtesy http://www.webelements.com/ ,TRUE,89.jpg90,Th,Thorium,232.03806,Thorium is a source of nuclear power. There is probably more untapped energy available for use from thorium in the minerals of the earth's crust than from combined uranium and fossil fuel sources. Much of the internal heat the earth has been attributed to thorium and uranium. When pure thorium is a silvery white metal which is air-stable and retains its lustre for several months. When contaminated with the oxide thorium slowly tarnishes in air becoming grey and finally black. Thorium oxide has a melting point of 3300¡C the highest of all oxides. Only a few elements such as tungsten and a few compounds such as tantalum carbide have higher melting points. Info courtesy http://www.webelements.com/ ,TRUE,90.jpg91,Pa,Protactinium,231.03588,Protactinium has a bright metallic lustre which it retains for some time in air. The element is superconductive below 1.4 K. The element is a dangerous toxic material and requires precautions similar to those used when handling plutonium. Protactinium is one of the rarest and most expensive naturally occurring elements. The element is an _-emitter and is a radiological hazard similar to polonium. Protactinium is a highly toxic and radioactive rare earth metal that requires special handling. It is found in pitchblende and ores form Zaire and is one of the rarest and most expensive naturally occurring elements. Info courtesy http://www.webelements.com/ ,TRUE,91.jpg92,U,Uranium,238.02891,Uranium is of great interest because of its application to nuclear power and nuclear weapons. Uranium contamination is an emotive environmental problem. It is not particularly rare and is more common than beryllium or tungsten for instance. Info courtesy http://www.webelements.com/ ,TRUE,92.jpg93,Np,Neptunium,237,Neptunium is a radioactive rare earth metal and has at least 3 allotropic forms. It is named for the planet Neptune. Np-237 is a by-product from nuclear reactors. Info courtesy http://www.webelements.com/ ,TRUE,93.jpg94,Pu,Plutonium,244,Plutonium was the second transuranium element of the actinide series to be discovered. By far of greatest importance is the isotope 239Pu which has a half-life of more than 20000 years. One kilogram is equivalent to about 22 million kilowatt hours of heat energy. The complete detonation of a kilogram of plutonium produces an explosion equal to about 20000 tons of chemical explosive. The various nuclear applications of plutonium are well known. The isotope 233Pu was used in the American Apollo lunar missions to power seismic and other equipment on the lunar surface. Plutonium contamination is an emotive environmental problem. Info courtesy http://www.webelements.com/ ,TRUE,94.jpg95,Am,Americium,243,The lustre of freshly prepared americium metal is whiter and more silvery than plutonium or neptunium prepared in the same manner. Americium is a component of the smoke detector above. Americium appears to be more malleable than uranium or neptunium and americium tarnishes slowly in dry air at room temperature. Americium is a radioactive rare earth metal which must be handled with care to avoid contact since it is a heavy _ and _ emitter. It is named after America. The _ activity of 241Am is about three times that of radium. Americium is available to qualified users in the UK and in the USA. Info courtesy http://www.webelements.com/ ,TRUE,95.jpg96,Cm,Curium,247,Curium is a hard brittle radioactive silvery metal. It does not occur in nature and must be made in a nuclear reactor by neutron capture reactions from plutonium and americium isotopes. It tarnishes slowly in dry air at room temperature. Curium was first produced in 1944 at the University of California Berkeley in the USA in a cyclotron by bombarding plutonium-239 (239Pu) with _-particles. It was isolated in visible quantities as the hydroxide Cm(OH)3 in 1947. Info courtesy http://www.webelements.com/ ,TRUE,96.jpg