97,Bk,Berkelium,247,Berkelium is a radioactive rare earth metal named after the University of California at Berkeley (USA). Apparently berkelium tends to accumulate in the skeletal system. It is of no commercial importance and only a few of its compounds are known. Info courtesy http://www.webelements.com/ ,TRUE,97.jpg98,Cf,Californium,251,Californium is a radioactive rare earth metal named after the state of California and the University of California (USA). Californium-252 is a strong neutron emitter and one microgram emits 170 million neutrons per minute making it a biological hazard. It has a few specialised uses but only a few of its compounds are known. Info courtesy http://www.webelements.com/ ,TRUE,98.jpg99,Es,Einsteinium,252,Einsteinium is radioactive rare earth metal named after Albert Einstein. It is of no commercial importance and only a few of its compounds are known. Info courtesy http://www.webelements.com/ ,TRUE,99.jpg100,Fm,Fermium,257,Fermium's chemical properties are largely unknown. Fermium is a radioactive rare earth metal. The longest living isotope is is 257Fm with a half-life of 80 days. It is of no commercial importance. Info courtesy http://www.webelements.com/ ,TRUE,100.jpg101,Md,Mendelevium,258,Mendelevium is a radioactive rare earth metal named after Dmitri Mendeleev father of the Periodic Table. Info courtesy http://www.webelements.com/ ,TRUE,101.jpg102,No,Nobelium,259,"Nobelium is a radioactive ""rare earth metal"" named after Alfred Nobel who discovered dynamite. Info courtesy http://www.webelements.com/ ",TRUE,102.jpg103,Lr,Lawrencium,262,"Lawrencium is a synthetic ""rare earth metal"" which does not occur in the environment. Info courtesy http://www.webelements.com/ ",TRUE,103.jpg104,Rf,Rutherfordium,261,Rutherfordium is a synthetic element that is not present in the environment at all. It has no uses. Info courtesy http://www.webelements.com/ ,TRUE,104.jpg105,Db,Dubnium,262,Dubnium is a synthetic element that is not present in the environment at all. It has no uses. Info courtesy http://www.webelements.com/ ,TRUE,105.jpg106,Sg,Seaborgium,266,Seaborgium is a synthetic element that is not present in the environment at all. It has no uses. Info courtesy http://www.webelements.com/ ,TRUE,106.jpg107,Bh,Bohrium,264,Bohrium is a synthetic element that is not present in the environment at all. The German discoverers at GSI proposed the name Nielsbohrium (symbol Ns) after Niels Bohr. IUPAC are happy to name an element after Bohr but suggest bohrium (Bh) on the grounds that the first name of a person does not appear in the names of any other element named after a person. This seems to have been accepted by all concerned. Info courtesy http://www.webelements.com/ ,TRUE,107.jpg108,Hs,Hassium,277,Hassium is a synthetic element that is not present in the environment at all. Info courtesy http://www.webelements.com/ ,TRUE,108.jpg109,Mt,Meitnerium,268,Element 109 meitnerium is a synthetic element that is not present in the environment at all. There is no dispute concerning the name meitnerium for element 109. Info courtesy http://www.webelements.com/ ,TRUE,109.jpg110,Ds,Ununnilium,271,Darmstadtium is a synthetic element that is not present in the environment at all.  Info courtesy http://www.webelements.com/ ,TRUE,110.jpg111,Rg,Unununium,272,Roentgenium was discovered on 8th December 1994 at the GSI in Darmstadt Germany. Info courtesy http://www.webelements.com/ ,TRUE,111.jpg112,Uub,Ununbium,285,Copernicium was discovered on 9th February 1996 at 22:37 at the GSI in Darmstadt Germany. Info courtesy http://www.webelements.com/ ,TRUE,112.jpg113,Uut,Ununtrium,284,Experiments resulting in the formation of element 115 were reported in February 2004 following experiments carried out between 14 July - 10 August 2003 involving scientists at Dubna (Joint Institute for Nuclear Research at the U400 cyclotron with the Dubna gas-filled recoil separator DGFRS) in Russia in a collaboration also involving scientists at the Lawrence Livermore National Laboratory USA. In these experiments the primary product were four nuclei of element 115 isotopes. All these four nuclei decayed through the emisson of _-particles to isotopes of element 113. The claim has not yet been ratified but the results are now published in a reputable peer-reviewed journal. Info courtesy http://www.webelements.com/ ,TRUE,113.jpg114,Fl,Flerovium,289,Flerovium was reported informally in January 1999 following experiments towards the end of December 1998 involving scientists at Dubna (Joint Institute for Nuclear Research) in Russia apparently using isotopes supplied by scientists at the Lawrence Livermore National Laboratory USA. Only one atom was identified at that time and the claim only just been ratified. The results of calculations suggest that flerovium will not form a tetrafluoride FlF4 but could be isolated as a water-soluble difluoride FlF2. Info courtesy http://www.webelements.com/ ,TRUE,114.jpg115,Uup,Ununpentium,288,Experiments resulting in the formation of element 115 were reported in February 2004 following experiments carried out between 14 July - 10 August 2003 involving scientists at Dubna (Joint Institute for Nuclear Research at the U400 cyclotron with the Dubna gas-filled recoil separator DGFRS) in Russia in a collaboration also involving scientists at the Lawrence Livermore National Laboratory USA. Only four nuclei were identified and the claim has not yet been ratified but the results are now published in a reputable peer-reviewed journal. Info courtesy http://www.webelements.com/ ,TRUE,115.jpg116,Lv,Livermorium,293,An isotope of livermorium 292Lv was identified in the reaction of 248Cm with 48Ca. It is very shortlived and decomposes to a known isotope of element 114 288114Fl. Info courtesy http://www.webelements.com/ ,TRUE,116.jpg117,Uuh,Ununhexium,294,"An article published in Physical Review Letters on 5 April 2010 (submitted 15 March 2010 ""Synthesis of a new chemical element with atomic number Z=117"" Joint Institute for Nuclear Research RU-141980 Dubna Russian Federation Oak Ridge National Laboratory Oak Ridge Tennessee 37831 USA University of Nevada Las Vegas Las Vegas Nevada 89154 USA Department of Physics and Astronomy Vanderbilt University Nashville Tennessee 37235 USA Lawrence Livemore National Laboratory Livermore California 94551 USA and Research Institute of Atomic Reactors RU-433510 Dimitrovgrad Russian Federation) claims the identification of six atoms of the isotopes 293Uus (five atoms) and 294Uus (one atom) in fusion reactions between 48Ca and 249Bk. Info courtesy http://www.webelements.com/ ",TRUE,117.jpg118,Uuo,Ununoctium,294,Experiments conducted at Dubna in Russia at the Flerov Laboratory of Nuclear Reactions (by workers from the Joint Institute for Nuclear Research in Russia and the Lawrence Livermore National Laboratory in the USA) indicate that element 118 (ununoctium Uuo) was produced. Not too much though one atom in the spring of 2002 and two more in 2005. Info courtesy http://www.webelements.com/ ,FALSE,118.jpg